{
    "$id": "https://raw.githubusercontent.com/IntersectMBO/cardano-config/v2/schemas/NetworkConfig.schema.json",
    "$schema": "http://json-schema.org/draft-07/schema#",
    "description": "NetworkConfiguration",
    "properties": {
        "$schema": {
            "default": "https://raw.githubusercontent.com/IntersectMBO/cardano-config/v2/schemas/NetworkConfig.schema.json",
            "description": "URL of the JSON Schema this NetworkConfig file follows (the $schema annotation), for editors and validators. Pinned to the vN tag of the format version it describes.",
            "title": "$schema",
            "type": "string"
        },
        "AcceptedConnectionsLimit": {
            "description": "Limits on accepted connections\nAcceptedConnectionsLimit",
            "properties": {
                "Delay": {
                    "default": 5,
                    "description": "Delay, in seconds, applied once the soft limit is reached",
                    "title": "Delay",
                    "type": "number"
                },
                "HardLimit": {
                    "default": 512,
                    "description": "Hard limit on the number of connections",
                    "maximum": 4294967295,
                    "minimum": 0,
                    "title": "HardLimit",
                    "type": "integer"
                },
                "SoftLimit": {
                    "default": 384,
                    "description": "Soft limit on the number of connections",
                    "maximum": 4294967295,
                    "minimum": 0,
                    "title": "SoftLimit",
                    "type": "integer"
                }
            },
            "required": [
                "Delay",
                "SoftLimit",
                "HardLimit"
            ],
            "title": "AcceptedConnectionsLimit",
            "type": "object"
        },
        "ChainSyncIdleTimeout": {
            "default": 3373,
            "description": "ChainSync idle timeout, in seconds",
            "title": "ChainSyncIdleTimeout",
            "type": "number"
        },
        "DeadlineTargetNumberOfActiveBigLedgerPeers": {
            "description": "Deadline target of active big ledger peers",
            "maximum": 9223372036854775807,
            "minimum": -9223372036854775808,
            "title": "DeadlineTargetNumberOfActiveBigLedgerPeers",
            "type": "integer"
        },
        "DeadlineTargetNumberOfActivePeers": {
            "description": "Deadline target of active peers",
            "maximum": 9223372036854775807,
            "minimum": -9223372036854775808,
            "title": "DeadlineTargetNumberOfActivePeers",
            "type": "integer"
        },
        "DeadlineTargetNumberOfEstablishedBigLedgerPeers": {
            "description": "Deadline target of established big ledger peers",
            "maximum": 9223372036854775807,
            "minimum": -9223372036854775808,
            "title": "DeadlineTargetNumberOfEstablishedBigLedgerPeers",
            "type": "integer"
        },
        "DeadlineTargetNumberOfEstablishedPeers": {
            "description": "Deadline target of established peers",
            "maximum": 9223372036854775807,
            "minimum": -9223372036854775808,
            "title": "DeadlineTargetNumberOfEstablishedPeers",
            "type": "integer"
        },
        "DeadlineTargetNumberOfKnownBigLedgerPeers": {
            "description": "Deadline target of known big ledger peers",
            "maximum": 9223372036854775807,
            "minimum": -9223372036854775808,
            "title": "DeadlineTargetNumberOfKnownBigLedgerPeers",
            "type": "integer"
        },
        "DeadlineTargetNumberOfKnownPeers": {
            "description": "Deadline target of known peers",
            "maximum": 9223372036854775807,
            "minimum": -9223372036854775808,
            "title": "DeadlineTargetNumberOfKnownPeers",
            "type": "integer"
        },
        "DeadlineTargetNumberOfRootPeers": {
            "description": "Deadline target of root peers",
            "maximum": 9223372036854775807,
            "minimum": -9223372036854775808,
            "title": "DeadlineTargetNumberOfRootPeers",
            "type": "integer"
        },
        "DiffusionMode": {
            "default": "InitiatorAndResponder",
            "description": "Initiator-only or initiator-and-responder",
            "enum": [
                "InitiatorOnly",
                "InitiatorAndResponder"
            ],
            "title": "DiffusionMode",
            "type": "string"
        },
        "EgressPollInterval": {
            "default": 0,
            "description": "Egress poll interval, in seconds",
            "title": "EgressPollInterval",
            "type": "number"
        },
        "ExperimentalProtocolsEnabled": {
            "default": false,
            "description": "Enable experimental network protocols",
            "title": "ExperimentalProtocolsEnabled",
            "type": "boolean"
        },
        "MaxConcurrencyBulkSync": {
            "default": 1,
            "description": "Bulk-sync block-fetch concurrency",
            "maximum": 1.8446744073709551615e19,
            "minimum": 0,
            "title": "MaxConcurrencyBulkSync",
            "type": "integer"
        },
        "MaxConcurrencyDeadline": {
            "default": 1,
            "description": "Deadline block-fetch concurrency",
            "maximum": 1.8446744073709551615e19,
            "minimum": 0,
            "title": "MaxConcurrencyDeadline",
            "type": "integer"
        },
        "MinBigLedgerPeersForTrustedState": {
            "default": 5,
            "description": "Minimum big ledger peers for trusted state",
            "maximum": 9223372036854775807,
            "minimum": -9223372036854775808,
            "title": "MinBigLedgerPeersForTrustedState",
            "type": "integer"
        },
        "PeerSharing": {
            "description": "Whether to enable peer sharing",
            "title": "PeerSharing",
            "type": "boolean"
        },
        "ProtocolIdleTimeout": {
            "default": 5,
            "description": "Protocol idle timeout, in seconds",
            "title": "ProtocolIdleTimeout",
            "type": "number"
        },
        "ResponderCoreAffinityPolicy": {
            "default": "NoResponderCoreAffinity",
            "description": "Whether responders are pinned to a core",
            "enum": [
                "NoResponderCoreAffinity",
                "ResponderCoreAffinity"
            ],
            "title": "ResponderCoreAffinityPolicy",
            "type": "string"
        },
        "SyncTargetNumberOfActiveBigLedgerPeers": {
            "default": 30,
            "description": "Sync target of active big ledger peers",
            "maximum": 9223372036854775807,
            "minimum": -9223372036854775808,
            "title": "SyncTargetNumberOfActiveBigLedgerPeers",
            "type": "integer"
        },
        "SyncTargetNumberOfActivePeers": {
            "default": 5,
            "description": "Sync target of active peers",
            "maximum": 9223372036854775807,
            "minimum": -9223372036854775808,
            "title": "SyncTargetNumberOfActivePeers",
            "type": "integer"
        },
        "SyncTargetNumberOfEstablishedBigLedgerPeers": {
            "default": 40,
            "description": "Sync target of established big ledger peers",
            "maximum": 9223372036854775807,
            "minimum": -9223372036854775808,
            "title": "SyncTargetNumberOfEstablishedBigLedgerPeers",
            "type": "integer"
        },
        "SyncTargetNumberOfEstablishedPeers": {
            "default": 10,
            "description": "Sync target of established peers",
            "maximum": 9223372036854775807,
            "minimum": -9223372036854775808,
            "title": "SyncTargetNumberOfEstablishedPeers",
            "type": "integer"
        },
        "SyncTargetNumberOfKnownBigLedgerPeers": {
            "default": 100,
            "description": "Sync target of known big ledger peers",
            "maximum": 9223372036854775807,
            "minimum": -9223372036854775808,
            "title": "SyncTargetNumberOfKnownBigLedgerPeers",
            "type": "integer"
        },
        "SyncTargetNumberOfKnownPeers": {
            "default": 150,
            "description": "Sync target of known peers",
            "maximum": 9223372036854775807,
            "minimum": -9223372036854775808,
            "title": "SyncTargetNumberOfKnownPeers",
            "type": "integer"
        },
        "SyncTargetNumberOfRootPeers": {
            "default": 0,
            "description": "Sync target of root peers",
            "maximum": 9223372036854775807,
            "minimum": -9223372036854775808,
            "title": "SyncTargetNumberOfRootPeers",
            "type": "integer"
        },
        "TimeWaitTimeout": {
            "default": 60,
            "description": "TIME-WAIT timeout, in seconds",
            "title": "TimeWaitTimeout",
            "type": "number"
        },
        "TxSubmissionInitDelay": {
            "default": 60,
            "description": "Tx-submission initial delay, in seconds",
            "title": "TxSubmissionInitDelay",
            "type": "number"
        },
        "TxSubmissionLogicVersion": {
            "default": "TxSubmissionLogicV1",
            "description": "Which tx-submission inbound logic to run",
            "enum": [
                "TxSubmissionLogicV1",
                "TxSubmissionLogicV2"
            ],
            "title": "TxSubmissionLogicVersion",
            "type": "string"
        }
    },
    "title": "NetworkConfig",
    "type": "object"
}
